{
    "$schema": "../../../../../../doc/3-drive-works-infra/7-基于json的cgf设计/graphlet.schema.json",
    "name": "RadarDopplerMotion",
    "inputPorts": {
        "RADAR_SCAN": {
            "type": "dwRadarScan",
            "array": 9
        }
    },
    "outputPorts": {
        "RADAR_DOPPLER_MOTION": {
            "type": "dwRadarDopplerMotion",
            "array": 9
        }
    },
    "parameters": {
        "radarDopplerMotionCudaStreamIndices": { "type": "int64_t", "array": 9, "default": [
            0,
            0,
            0,
            0,
            0,
            0,
            0,
            0,
            0
        ] },
        "enabled": { "type": "bool", "array": 9, "default": [
            true,
            true,
            true,
            true,
            true,
            false,
            false,
            false,
            false
        ] }
    },
    "subcomponents": {
        "radarDopplerMotionNode0": {
            "componentType": "../../../../../src/dwframework/dwnodes/dwradardopplermotionnode/dwRadarDopplerMotionNode.node.json",
            "parameters": {
                "*": "$*",
                "index": 0
            }
        },
        "radarDopplerMotionNode1": {
            "componentType": "../../../../../src/dwframework/dwnodes/dwradardopplermotionnode/dwRadarDopplerMotionNode.node.json",
            "parameters": {
                "*": "$*",
                "index": 1
            }
        },
        "radarDopplerMotionNode2": {
            "componentType": "../../../../../src/dwframework/dwnodes/dwradardopplermotionnode/dwRadarDopplerMotionNode.node.json",
            "parameters": {
                "*": "$*",
                "index": 2
            }
        },
        "radarDopplerMotionNode3": {
            "componentType": "../../../../../src/dwframework/dwnodes/dwradardopplermotionnode/dwRadarDopplerMotionNode.node.json",
            "parameters": {
                "*": "$*",
                "index": 3
            }
        },
        "radarDopplerMotionNode4": {
            "componentType": "../../../../../src/dwframework/dwnodes/dwradardopplermotionnode/dwRadarDopplerMotionNode.node.json",
            "parameters": {
                "*": "$*",
                "index": 4
            }
        },
        "radarDopplerMotionNode5": {
            "componentType": "../../../../../src/dwframework/dwnodes/dwradardopplermotionnode/dwRadarDopplerMotionNode.node.json",
            "parameters": {
                "*": "$*",
                "index": 5
            }
        },
        "radarDopplerMotionNode6": {
            "componentType": "../../../../../src/dwframework/dwnodes/dwradardopplermotionnode/dwRadarDopplerMotionNode.node.json",
            "parameters": {
                "*": "$*",
                "index": 6
            }
        },
        "radarDopplerMotionNode7": {
            "componentType": "../../../../../src/dwframework/dwnodes/dwradardopplermotionnode/dwRadarDopplerMotionNode.node.json",
            "parameters": {
                "*": "$*",
                "index": 7
            }
        },
        "radarDopplerMotionNode8": {
            "componentType": "../../../../../src/dwframework/dwnodes/dwradardopplermotionnode/dwRadarDopplerMotionNode.node.json",
            "parameters": {
                "*": "$*",
                "index": 8
            }
        }
    },
    "connections": [
        {
            "src": "radarDopplerMotionNode0.RADAR_DOPPLER_MOTION",
            "dests": {"RADAR_DOPPLER_MOTION[0]": {}}
        },
        {
            "src": "radarDopplerMotionNode1.RADAR_DOPPLER_MOTION",
            "dests": {"RADAR_DOPPLER_MOTION[1]": {}}
        },
        {
            "src": "radarDopplerMotionNode2.RADAR_DOPPLER_MOTION",
            "dests": {"RADAR_DOPPLER_MOTION[2]": {}}
        },
        {
            "src": "radarDopplerMotionNode3.RADAR_DOPPLER_MOTION",
            "dests": {"RADAR_DOPPLER_MOTION[3]": {}}
        },
        {
            "src": "radarDopplerMotionNode4.RADAR_DOPPLER_MOTION",
            "dests": {"RADAR_DOPPLER_MOTION[4]": {}}
        },
        {
            "src": "radarDopplerMotionNode5.RADAR_DOPPLER_MOTION",
            "dests": {"RADAR_DOPPLER_MOTION[5]": {}}
        },
        {
            "src": "radarDopplerMotionNode6.RADAR_DOPPLER_MOTION",
            "dests": {"RADAR_DOPPLER_MOTION[6]": {}}
        },
        {
            "src": "radarDopplerMotionNode7.RADAR_DOPPLER_MOTION",
            "dests": {"RADAR_DOPPLER_MOTION[7]": {}}
        },
        {
            "src": "radarDopplerMotionNode8.RADAR_DOPPLER_MOTION",
            "dests": {"RADAR_DOPPLER_MOTION[8]": {}}
        },
        {
            "src": "RADAR_SCAN[0]",
            "dests": {"radarDopplerMotionNode0.RADAR_SCAN": {}}
        },
        {
            "src": "RADAR_SCAN[1]",
            "dests": {"radarDopplerMotionNode1.RADAR_SCAN": {}}
        },
        {
            "src": "RADAR_SCAN[2]",
            "dests": {"radarDopplerMotionNode2.RADAR_SCAN": {}}
        },
        {
            "src": "RADAR_SCAN[3]",
            "dests": {"radarDopplerMotionNode3.RADAR_SCAN": {}}
        },
        {
            "src": "RADAR_SCAN[4]",
            "dests": {"radarDopplerMotionNode4.RADAR_SCAN": {}}
        },
        {
            "src": "RADAR_SCAN[5]",
            "dests": {"radarDopplerMotionNode5.RADAR_SCAN": {}}
        },
        {
            "src": "RADAR_SCAN[6]",
            "dests": {"radarDopplerMotionNode6.RADAR_SCAN": {}}
        },
        {
            "src": "RADAR_SCAN[7]",
            "dests": {"radarDopplerMotionNode7.RADAR_SCAN": {}}
        },
        {
            "src": "RADAR_SCAN[8]",
            "dests": {"radarDopplerMotionNode8.RADAR_SCAN": {}}
        }
    ]
}
