{
    "name": "CameraSensorFront",
    "inputPorts": {
        "VIRTUAL_SYNC_TIME": {
            "type": "dwTime_t"
        },
        "SENSOR_EXTRINSICS": {
            "type": "dwCalibratedExtrinsics"
        }
    },
    "outputPorts": {
        "SENSOR_PROPERTIES": {
            "type": "dwSensorNodeProperties"
        },
        "INTRINSICS": {
            "type": "dwCameraIntrinsics"
        },
        "CUDA_PROCESSED": {
            "type": "dwImageHandle_t"
        },
        "IMAGE_TIMESTAMP": {
            "type": "dwTime_t"
        },
        "NEXT_IMAGE_TIMESTAMP": {
            "type": "dwTime_t"
        },
        "IMAGE_TIMESTAMP_AND_ID": {
            "type": "dwSensorTsAndID"
        },
        "CUDA_ISP_YUV_UINT_8_HALF_RES": {
            "type": "dwImageHandle_t",
            "array": 2
        },
        "CUDA_ISP_YUV_UINT_8_TWO_MP_RES": {
            "type": "dwImageHandle_t",
            "array": 2
        }
    },
    "parameters": {
        "cameraIndex_1": {
            "type": "size_t",
            "default": 0
        },
        "cameraIndex_2": {
            "type": "size_t",
            "default": 1
        },
        "streamIndex": {
            "type": "size_t",
            "default": 0
        },
        "enable2MpOutput_1": {
            "type": "bool",
            "default": false
        },
        "enable2MpOutput_2": {
            "type": "bool",
            "default": false
        },
        "useEEPROMIntrinsics": {
            "type": "bool",
            "default": false
        },
        "frameSkipMask": {
            "type": "dw::core::FixedString<32>",
            "default": ""
        }
    },
    "subcomponents": {
        "cameraNode": {
            "componentType": "../../../../../src/dwframework/dwnodes/sensors/dwcameranode/dwCameraNode.node.json",
            "parameters": {
                "streamIndex": "$streamIndex",
                "cameraIndex": "$cameraIndex_1",
                "useEEPROMIntrinsics": "$useEEPROMIntrinsics",
                "frameSkipMask": "$frameSkipMask"
            }
        },
        "ispNode1": {
            "componentType": "../../../nodes/ISPNode.node.json",
            "parameters": {
                "streamIndex": "$streamIndex",
                "cameraIndex": "$cameraIndex_1",
                "enable2MpOutput": "$enable2MpOutput_1"
            }
        },
        "ispNode2": {
            "componentType": "../../../nodes/ISPNode.node.json",
            "parameters": {
                "streamIndex": "$streamIndex",
                "cameraIndex": "$cameraIndex_2",
                "enable2MpOutput": "$enable2MpOutput_2"
            }
        }
    },
    "connections": [
        {
            "src": "cameraNode.IMAGE_NATIVE_PROCESSED",
            "dests": {
                "ispNode1.IMAGE": {},
                "ispNode2.IMAGE": {},
                "CUDA_PROCESSED": {}
            },
            "params": {
                "singleton": true
            }
        },
        {
            "src": "VIRTUAL_SYNC_TIME",
            "dests": {
                "cameraNode.VIRTUAL_SYNC_TIME": {}
            }
        },
        {
            "src": "SENSOR_EXTRINSICS",
            "dests": {
                "cameraNode.SENSOR_EXTRINSICS": {}
            }
        },
        {
            "src": "cameraNode.SENSOR_PROPERTIES",
            "dests": {
                "SENSOR_PROPERTIES": {}
            }
        },
        {
            "src": "cameraNode.INTRINSICS",
            "dests": {
                "INTRINSICS": {}
            }
        },
        {
            "src": "cameraNode.IMAGE_TIMESTAMP",
            "dests": {
                "IMAGE_TIMESTAMP": {}
            }
        },
        {
            "src": "cameraNode.IMAGE_TIMESTAMP_AND_ID",
            "dests": {
                "IMAGE_TIMESTAMP_AND_ID": {}
            }
        },
        {
            "src": "cameraNode.NEXT_IMAGE_TIMESTAMP",
            "dests": {
                "NEXT_IMAGE_TIMESTAMP": {}
            }
        },
        {
            "src": "ispNode1.IMAGE_YUV",
            "dests": {
                "CUDA_ISP_YUV_UINT_8_HALF_RES[0]": {}
            }
        },
        {
            "src": "ispNode1.IMAGE_YUV_2MP",
            "dests": {
                "CUDA_ISP_YUV_UINT_8_TWO_MP_RES[0]": {}
            }
        },
        {
            "src": "ispNode2.IMAGE_YUV",
            "dests": {
                "CUDA_ISP_YUV_UINT_8_HALF_RES[1]": {}
            }
        },
        {
            "src": "ispNode2.IMAGE_YUV_2MP",
            "dests": {
                "CUDA_ISP_YUV_UINT_8_TWO_MP_RES[1]": {}
            }
        }
    ]
}
